key,title,year,month,day,journal,issn,volume,issue,pages,authors,url,language,publisher,location,abstract,notes,doi,keywords,pubmed_id,pmc_id,PDF files,[]
rayyan-304195858,School Leadership Enhances Secondary Students' Achievement in Rural China Through Teacher Commitment and Collaborative Culture,2022.0,1,1,,,,,,"Li, L and Zhu, HX and Li, H",,,,,"The effect of school leadership (SL) on student achievement (SA) has been extensively examined, whereas the influences of teacher commitment (TC) and collaborative culture (CC) have not been thoroughly explored. This study conducted a moderated mediation analysis by investigating (a) TC as a mediator in the relationship between SL and SA and (b) CC as a moderator of the relationship between SL and SA. Altogether, 3,134 (female =1,673, 53.4%; male =1,461, 46.4%) students and their 841 teachers from 80 middle schools in rural China were recruited and surveyed. SA was evaluated using Program for International Student Assessment (PISA) 2008 tests, including reading, math, and science, and SL, TC, and CC were evaluated using the Teaching and Leading in Schools Survey Scale. In addition, the ""many to many"" step was employed to match teachers' data with the students' data by STATA analysis. The results indicated that: (1) there were direct and indirect effects of SL on SA in the mediation model; (2) TC was confirmed as a full mediator between SL and SA; and (3) CC acted as a significant moderator of SL effects on SA through TC. Implications for improving school leadership and student achievement are discussed.","",,"",,,"",""
rayyan-304195860,FOUR DECADES OF COLLECTIVE LEADERSHIP The Connection Between Leadership Theories of Action and Student Achievement,2016.0,1,1,,,,,,"Nordengren, C",,,,,,"",,"",,,"",""
rayyan-304195864,To what extent is shared instructional leadership related to teacher self-efficacy and student academic performance in China?,2022.0,1,1,,,,,,"Liu, Y and Li, L and Huang, C",,,,,"Even though the concept has been introduced more than 2 decades ago, available evidence conventionally operationalises shared instructional leadership as a composite, which has missed the opportunity to reveal to what extent principal and teacher instructional leadership helps improve instructional outcomes. Using the complex survey data collected in China, this research employed a three-level structural equation model to investigate the multidimensional relationships among principal and teacher instructional leadership, teacher self-efficacy, and student learning outcomes. The results suggest principal instructional leadership is significantly related to teacher instructional leadership. Both are positively related to teacher self-efficacy and student performance, though the effect sizes vary noticeably. Using a survey design, this study has added international and nuanced evidence to the shared instructional leadership research, through an integrated model emphasising both principals' and teachers' leading roles.","",,"",,,"",""
rayyan-304195866,THE EFFECTS OF TRANSFORMATIONAL LEADERSHIP ON TEACHER ATTITUDES AND STUDENT PERFORMANCE IN SINGAPORE,1995.0,1,1,,,,,,"KOH, WL and STEERS, RM and TERBORG, JR",,,,,"Transformational leadership theory was examined in 89 schools in Singapore using a split sample technique (N = 846 teachers). The study sought to examine the influence of transformational leader behavior by school principals as it related to organizational commitment, organizational citizenship behavior, teacher satisfaction with leader, and student academic performance. Attitudinal and behavioral data were collected from both teachers and principals; student academic performance was collected from school records. School level analyses showed that transformational leadership had significant add-on effects to transactional leadership in the prediction of organizational commitment, organizational citizenship behavior, and teacher satisfaction. Moreover, transformational leadership was found to have indirect effects on student academic achievement. Finally, it was found that transactional leadership had little add-on effect on transformational leadership in predicting outcomes. Implications and directions for future research are discussed.","",,"",,,"",""
rayyan-304195868,Putting the Instructional Leadership-Student Achievement Relation in Context: A Meta-Analytical Big Data Study Across Cultures and Time,2025.0,1,1,,,,,,"Pietsch, M and Aydin, B and Gümüs, S",,,,,"Aggregated data meta-analyses indicate a correlation between instructional leadership and student achievement. However, it is unclear to what extent this relationship can be generalized across cultural contexts, as most primary studies stem from Anglophone regions. Drawing on international large-scale assessment data, this 3-level individual participant data (IPD) meta-analysis examines this relationship over a 6-year period using a sample of 1.5 million students in more than 50,000 schools from 75 countries. The findings show that the mean correlation is close to 0 and that the relationship between instructional leadership and student achievement varies significantly across contexts. This is mainly due to the level of human development and cultural factors. Implications for policy, practice, and education research are discussed.","",,"",,,"",""
rayyan-304195869,Literature review of transformational school leadership: models and effects on student achievement (2006-2019),2024.0,1,1,,,,,,"Li, YZ and Karanxha, Z",,,,,This systematic literature review critically evaluates 14 empirical studies published over a 14 years span (2006-2019) to answer questions about the models and the effects of transformational school leadership on student academic achievement. The analysis of the related literature utilized vote counting and narrative synthesis to delineate the status quo of the current research field. It was found that the majority of these studies were conducted in Western and English- speaking countries and these studies utilizing different research methods and models reported mixed results. Recommendations for future research directions include use of an integrated leadership framework and complexity in the study of leadership in schools.,"",,"",,,"",""
rayyan-304195870,How Does Principals' Transformational Leadership Impact Students' Modernity? A Multiple Mediating Model,2021.0,1,1,,,,,,"Wang, ST",,,,,"To explore the impact mechanism of principals' transformational leadership on students' modernity, this study adopted the structural equation model to test the multiple mediating effects of school climate, teacher quality, and effective teaching on the relationship between principals' transformational leadership and students' modernity. Results showed that there was a positive correlation between principals' transformational leadership and students' modernity; school climate, teacher quality, and effective teaching fully mediated the relationship between principals' transformational leadership and students' modernity, totally accounting for 64.37% of all the indirect effects; the mediating effects of school climate, teacher quality, and effective teaching, respectively, accounted for 30.20%, 52.29%, and 17.51%. According to these results, principal should adopt the approach of transformational leadership, promote the constructing of a fair, inclusive and innovative school climate, emphasize the improvement of teachers' social, emotional, and innovative qualities, and encourage teachers to reflect their teaching and conduct rational practices to improve students' modernity.","",,"",,,"",""
rayyan-304195874,"Principal self-efficacy for instructional leadership in the perspective of principal strengthening training: work engagement, job satisfaction and motivation to leave",2022.0,1,1,,,,,,"Dami, ZA and Wiyono, BB and Imron, A and Burhanuddin, B and Supriyanto, A and Daliman, M",,,,,"The current study explored relations between principal self-efficacy for instructional leadership, work engagement, job satisfaction, and motivation to leave the work as a principal from the principal strengthening training perspective. Participants in the study were 125 principals in the junior school selected using a saturated sampling procedure. This study uses qualitative methods with structural equation modeling (SEM). SEM analysis revealed that principal self-efficacy for instructional leadership was positively related to work engagement and job satisfaction. The relationship between principal self-efficacy for instructional leadership and motivation to leave was not significant. Work engagement and job satisfaction are positively related to motivation to leave. This study showed that Indonesian government policies related to the training of strengthening principals improve principal self-efficacy for instructional leadership. Based on the results of this study, the successful implementation of principal strengthening training in Indonesia can be adopted by policymakers from other countries because it can increase self-efficacy for instructional leadership, work engagement, job satisfaction, and prevent motivation to leave from the principal. In particular, this principal strengthening training program uses the ORPAER intervention model (observe, reflect, plan, act, evaluation, and reflect) combined from the syntax of Theory U and the ILEAD (Introduction, Link, Enforcement, Awareness, and Development) approach. This intervention model can improve the competence of principals, the principals' problem-solving skills, creative thinking, and emotional engagements.","",,"",,,"",""
rayyan-304195877,K-2 principal knowledge (not leadership) matters for dyslexia intervention,2021.0,1,1,,,,,,"Schraeder, M and Fox, J and Mohn, R",,,,,"Kindergarten through second-grade elementary schools that best serve students with dyslexia have principals who are knowledgeable about dyslexia and understand the best practices for providing intervention for students with dyslexia. In this study, three styles of leadership were examined to understand the implication that leadership has on intervention for dyslexia: transformational, instructional, and integrated leadership. However, many students in elementary schools have difficulty learning to read despite good leadership by the principal, with 5-20% of students being diagnosed with dyslexia. While these students need phonetic, multisensory intervention to build necessary reading skills, this study found that many principals lack knowledge of this specialized instruction. The purpose of this research was to explore variables that determine the school-based level of appropriate intervention for students with dyslexia. A questionnaire assessing leadership skills, knowledge, and beliefs about dyslexia, preparation in reading disorders and/or dyslexia received from degree programs and professional development, and services provided to students with dyslexia was given to K-2 principals serving in schools across the United States. Results indicated that regardless of leadership style, principals who have greater knowledge and more correct beliefs about dyslexia provide more appropriate school-based services for students with dyslexia. Eight detailed K-2 principal/practitioner recommendations are included based upon this key finding.","",,"",,,"",""
rayyan-304195878,How transformational leadership influences teachers' commitment and innovative practices: Understanding the moderating role of trust in principal,2024.0,1,1,,,,,,"Kilinç, AÇ and Polatcan, M and Savas, G and Er, E",,,,,"This study tested a moderated mediation model of transformational leadership's effects on teacher innovative practices, with teacher commitment as mediator and trust in principal as moderator. Implementing a cross-sectional survey design and using data from 611 teachers working in 56 schools in Turkey, we employed multilevel structural equation modelling with Bayesian estimation to estimate the structural links between our variables. The results provided evidence of the indirect effects of transformational leadership on teacher innovative practices through the significant mediator role of teacher commitment. We also found evidence that trust in principal acted as a significant moderator of the indirect effect of transformational leadership on teacher innovative practice through teacher commitment. This study adds nuanced evidence to the global literature by concluding that the effect of transformational leadership on teacher commitment and innovative practice is contingent upon the extent to which teachers trust their principals. We conclude with key implications for policy and practice.","",,"",,,"",""
rayyan-304195879,Building coherence for school improvement through integrated school leadership model: evidence from public secondary schools in Ethiopia,2025.0,1,1,,,,,,"Gao, CH and Wu, H and Tadesse, E and Khalid, S and Duan, CY",,,,,"The relevance of school principals' leadership behaviour in promoting school effectiveness and improvement is less discussed and known in emerging countries, explicitly in Sub-Saharan countries. Moreover, there is a significant inconclusive body of literature on the most dominant leadership model (instructional (IL) and transformational (TL) in determining the coherence of school improvement and student academic achievement. Hence, the current study extended the knowledge by examining the impact of IL and TL on implementing the School Improvement Programme (SIP) in the Ethiopian context designed to foster students' academic performance. This study randomly sampled and surveyed 2880 public secondary school teachers and 70 principals. The study's findings suggested that school principals' personal information, gender, academic qualification, and leadership experience determine their leadership style, the coherence of SIP, and school performance. Unlike previous evidence, this study's findings shed light on the principals' IL and TL practice, which significantly impacted students' academic achievement through the mediating role of coherent SIP.","",,"",,,"",""
rayyan-304195880,How does teacher self-efficacy mediate the relationship between student outcomes and principal leadership for learning? Results from meta-analytic structural equation modelling (MASEM),2025.0,1,1,,,,,,"Ozdogru, M and Tulubas, T and Karakose, T and Kanadli, S and Kardas, A and Papadakis, S",,,,,"Principal leadership behaviors affect the improvement of school outcomes significantly, not only by providing psychological and professional support for teachers but also by facilitating a positive learning environment at school. This has cultivated both policy and research interest in understanding how principals' leadership behaviors can leverage student outcomes both directly and indirectly through teachers. In this quest, three leadership models have become prominent due to their close relation to classroom instruction and learning: instructional, transformational, and distributed leadership. The current study aims to reveal the relationships between these leadership behaviors of principals and student outcomes as well as assess the mediating effect of teacher self-efficacy on this relationship. Utilizing meta-analytic structural equation modelling (MASEM) methodology, the study analyzes data from prior studies to offer a more comprehensive and holistic analysis of the complex relationships between the variables. The analysis of data from 90 studies showed that all three leadership behaviors affected student outcomes both directly and indirectly through teacher self-efficacy. They also had a moderate direct influence on teacher self-efficacy, while teacher self-efficacy had a moderate effect on student outcomes. These results reiterate the significance of principals' leadership for learning to facilitate student outcomes and suggest that the integrated practice of leadership in accordance with contextual requirements could leverage the effectiveness and improvement of schools.","",,"",,,"",""
rayyan-304195881,The influences of teachers' perceptions of using student achievement data in evaluation and their self-efficacy on job satisfaction: evidence from China,2018.0,1,1,,,,,,"Liu, SJ and Xu, XX and Stronge, J",,,,,"This study employed survey research in China to investigate the relationships among teacher evaluation, teacher self-efficacy, and teacher job satisfaction, while controlling for demographic variables. Four hundred and twenty-five teachers from a medium-sized city in Heilongjiang Province participated. The study examined the teachers' perceptions regarding using student achievement data in evaluation, finding mixed views about the inclusion of student scores, consistent with many recent studies on teacher evaluation reforms. Principal component analysis was conducted on the perception data and three factors emerged. The three factors were used in hierarchical multiple regression analyses and, in addition, three variables of teacher self-efficacy (i.e., efficacy for student engagement, efficacy for instructional strategies, and efficacy for classroom management) also were included in the analyses. The analyses found that (a) teachers' perceptions of their evaluation have a significant explanatory power on their job satisfaction, and (b) when their perceptions of evaluation are controlled, teachers' self-efficacy can explain additional variance in teachers' job satisfaction. Specifically, teachers' self-efficacy for student engagement was significantly predictive. Implications for educational policymakers and practitioners in light of enhancing teacher job satisfaction and developing rigorous teacher evaluation are discussed.","",,"",,,"",""
rayyan-304195883,The effect of educational leadership on students' achievement: a meta-analysis study,2015.0,1,1,,,,,,"Karadag, E and Bektas, F and Çogaltay, N and Yalçin, M",,,,,"In this meta-analysis study, different leadership styles were combined, and the relationship between educational leadership and student achievement was analyzed. In the literature review, 57 research articles/dissertations, independent from one another, were brought together, and 28,964 study subjects were included in the sample group. The results of the analyses performed with a random effects model revealed that educational leadership has a medium effect on students' achievement. As was expected, the most comprehensive effect among leadership styles was found in distributive and transformational leadership. Considering the effect of educational leadership on students' achievement, it is recommended to examine the effect of leadership on other components of school and shareholders in future studies.","",,"",,,"",""
rayyan-304195884,The Influence of Principal Leadership on Classroom Instruction and Student Learning: A Study of Mediated Pathways to Learning,2012.0,1,1,,,,,,"Sebastian, J and Allensworth, E",,,,,"Purpose: This study examines the influence of principal leadership in high schools on classroom instruction and student achievement through key organizational factors, including professional capacity, parent-community ties, and the school's learning climate. It identifies paths through which leadership explains differences in achievement and instruction between schools and differences in instruction among teachers within the same school. Research Design: Multilevel structural equation modeling was used to examine the relationships among principal leadership, school organizational structures, classroom instruction, and student grades and test gains on ACT's Education Planning and Assessment System. Measures of principal leadership and school organizational structures were collected from teacher surveys administered to all high school teachers in Chicago Public Schools in the 2006-2007 school years. Findings: Within schools, variation in classroom instruction is associated with principal leadership through multiple pathways, the strongest of which is the quality of professional development and coherence of programs. Between schools, differences in instruction and student achievement are associated with principal leadership only via the learning climate. This suggests that in high schools, establishing a safe, college-focused climate may be the most important leadership function for promoting achievement schoolwide.","",,"",,,"",""
rayyan-304195885,The Moderation Role of Transformational Leadership in the Effect of Instructional Leadership on Teacher Professional Learning and Instructional Practice: An Integrated Leadership Perspective,2021.0,1,1,,,,,,"Bellibas, MS and Kilinç, AÇ and Polatcan, M",,,,,"Aim: While integrated leadership has received significant scholarly attention in the past decade, most existing research in this vein has focused on its impact on student achievement and often dismissed how it might be related to instructional practices, which are at the center of many school reforms. In this research, we examined the relationship between integrated leadership and teacher professional learning and teacher practices in Turkey, where educational policy makers have recently introduced several school reform initiatives. More specifically, we aimed to examine the moderating function of transformational leadership in the relationship between instructional leadership and teacher practices, with an emphasis on the mediating role of teacher professional learning. Research Design: We conducted this study with a cross-sectional design and moderated mediation model. Data collected from 616 teachers working in a mix of primary and secondary schools in Turkey were analyzed using structural equation modeling and bootstrapping tests. Findings: We found evidence that transformational leadership acted as a moderator of the indirect effect of principal instructional leadership on teachers' instructional practices through teacher professional learning. Implications: This study adds to the accumulated body of knowledge on the effects of school leadership by concluding that the effect of instructional leadership on teacher learning and practice is contingent upon the extent to which principals enact transformational leadership. School principals who adopt a more comprehensive leadership approach that combines instructional leadership and transformational leadership practices can maximize their effects on student achievement through teacher learning, and better address the ever-growing demands of educational reforms.","",,"",,,"",""
rayyan-304195887,Science for our children: Othermothering leadership within an elementary science network,2024.0,1,1,,,,,,"Marshall, SL and Forrester, J and Tilsen, J",,,,,"Transformational equity-centered science education requires the fields of science education and school leadership to critically consider the limited preparation elementary principals are offered to lead for science education. Thus far, little effort has been made to foster a transdisciplinary curricula beyond traditional organizational theories related to school culture and climate; learning sciences; and supervision. School leadership programs are currently inadequately preparing elementary leaders in rigorous pedagogies involving science education. Although the role of principals is often not discussed concerning science implementation in elementary education, principals play a critical role in science decision-making. In this study, the authors present a case study of one elementary principal who also served as an othermother. Othermothers have been described as those who share mothering responsibilities in Black communities. Through interview transcripts, field notes, and social network data, the authors examine how this othermother cared for her students and community by advocating for science instruction. By strategically navigating the socio-political and policy climate and drawing on her authentic relationships, this othermother was critical in implementing a science agenda for elementary science. Three themes that emerged from the data analysis are, (1) othermothers view science as a potential means to transform lives and fulfill the needs of the local community, (2) science policies (i.e., federal, state, and local) can limit the potential of the vision of science an othermother has for the community, (3) othermothers draw on their community to guide equitable science instruction. Overall, othermothers have visions for what science can do. However, they cannot counter the status quo individually. Collective action among educators in various roles is one means of moving an equity agenda concerning science education forward.","",,"",,,"",""
rayyan-304195889,The mediating effect of teacher self-efficacy regarding the relationship between transformational school leadership and teacher agency,2023.0,1,1,,,,,,"Polatcan, M and Arslan, P and Balci, A",,,,,"The quality of school leaders and teachers is critical to both school development and student achievement. Thus, quality school leaders are needed for teachers to perform their assigned roles and tasks in line with the school goals. This paper examined the effect of transformational leadership behaviours of school principals on teacher agency. The study adopted a correlational research method and was conducted with 349 teachers working in primary, middle, and secondary schools of 15 cities located in eastern, central, and western Anatolia regions. Based on the variables observed in the school, path analysis was applied to analyse the relationships between implicit variables. A direct relationship was found between the transformational leadership practice of school principals and teachers' behaviours. In addition, transformational leadership practices of school principals had a direct as well as a moderate effect on teacher agency; teacher self-efficacy led to an indirect increase on this effect.","",,"",,,"",""
