key,title,year,month,day,journal,issn,volume,issue,pages,authors,url,language,publisher,location,abstract,notes,doi,keywords,pubmed_id,pmc_id,PDF files,[]
rayyan-304195357,Empowering Educational Leadership: Strategies for Quality Education in a Changing World,2025.0,1,1,,,,,,"Edwar, M.E. and Al-Ayash, A.A. and Emran, A.Q. and Nadheer, A.",,,,,"It is crucial to note that educational leadership is one of the most active drivers of various forms of change within institutions. This review tends to discuss various types of leadership styles, including democratic, autocratic, transformational, servant, and transactional, and how these different approaches influence the handling of change in schools. From the literature review, it is clear that various approaches toward leadership may give different results depending on the context and the specific condition of the challenge that faces educational leaders. While democratic, transformational, and servant leadership are likely to foster collaboration, inclusiveness, and creativity, autocratic and transactional forms of leadership ensure timely decision-making and maintenance of order in certain circumstances. The findings suggest that, for educational leaders to be successful, they need to implement flexible approaches to the needs of their institutions in creating settings that will support student achievement and innovation, as well as foster general school improvement. This review therefore concludes with implications for leadership practices in driving successful change initiatives in education. © The Author(s), under exclusive license to Springer Nature Switzerland AG 2025.","",,"",,,"",""
rayyan-304195360,Transformational school leadership effects on student achievement,2014.0,1,1,,,,,,"Sun, J. and Leithwood, K.",,,,,"Based on a synthesis of unpublished transformational school leadership (TSL) research completed during the last 14 years, this study inquired into the nature of TSL and its effects on student achievement using review methods including standard meta-analysis and vote-counting techniques. Results identift a wider range of TSL practices than typically has been measured in previous TSL research. Results also suggest that TSL has small but significant efli!cts on student achievement, some TSL practices are especially powerful explanations of these effects, and a large handful of variables both moderate and mediate TSL effects on students. © 2014 Authors. All rights reserved.","",,"",,,"",""
rayyan-304195366,Instructional leadership and effective teaching and learning,2021.0,1,1,,,,,,"Xhomara, N.",,,,,"School leadership has been identified as a key function in assuring quality in education. The instructional leadership model refers to the role and the functions of school leadership to employ different management tasks with regards to teaching and learning. Instructional leadership role includes (a) developing mission and goals, (b) managing the educational production function, (c) promoting an academic learning climate, and (d) developing a supportive work environment. Instructional leaders were described as leading from a combination of both expertise and charisma focused primarily on the improvement of student learning outcomes. The monograph, entitled Instructional Leadership and Effective Teaching and Learning and written by Nazmi Xhomara, is dedicated to school instructional leadership as an important factor that influences teaching and learning at school. In the first chapter, the author presents and analyzes educational leadership vs educational management, as well as models of educational leadership and management. The author argues on the importance of different leadership models, such as managerial leadership, transformational leadership, participative leadership, interpersonal leadership, transactional leadership, postmodern leadership, moral leadership, and contingent leadership. Chapters Two, Three, and Four shed light on instructional leadership and teaching and learning, understanding of instructional leadership, the concept and practice of instructional leadership, instructional school leadership and learning environment, attributes of instructional leaders, instructional excellence, instructional leadership time management, effective teaching and teachers, as well as teaching challenges and learning environment. Meanwhile, the author has analyzed constructivism, student intelligence, understanding of supervision, instructional collegial supervision, supervision approaches, understanding of evaluation of teaching and learning, teacher evaluation, and instructional observing instruments in chapters Five, Six, and Seven. Chapters Eight and Nine are focused especially on the research work of the relationships between instructional leadership and teaching, learning, and students' achievements, as well as on an empirical study designed and conducted in Albania as a case. Chapters Ten and Eleven are dedicated to instructional leadership preparation and the future of instructional leadership. As a conclusion, Xhomara indicates that principals are responsible for developing school climates and cultures that support the very best instructional practices. The new era of instructional leadership has predictably placed significant demands for accountability for student success and equity on the principal as well as for the university programs that prepare them. Working in twenty-first-century schools, the instructional leader is held more accountable than ever for student success. © 2021 by Nova Science Publishers, Inc. All rights reserved.","",,"",,,"",""
rayyan-304195367,Competencies measured in assessment centers: Predictors of transformational leadership and leader's effectiveness,2016.0,1,1,,,,,,"Docekalova, S. and Vaculik, M. and Prochazka, J.",,,,,"The objective of this study is to explore which competencies predict leader effectiveness. Based on theory and job analysis, we observed the effects of five leaders' competencies (achievement orientation, problem analysis and problem solving, social sensitivity, influence, and integrity) on three indicators of effectiveness (perceived leader's effectiveness, leadership emergence, and team performance). Furthermore, we examined whether transformational leadership mediates these effects. We collected the data during an interuniversity student team competition. A total of 57 team leaders and 364 team members participated in the study. At the beginning of the competition, we measured the leaders' competencies through assessment centers. Each leader was assessed by 4 trained assessors in a one day long assessment center consisting of multiple individual and group model situations. After 6 months of teamwork, we measured the perceived leaders' effectiveness, leadership emergence and transformational leadership using questionnaires, and we estimated the teams' performance based on the ranking of the teams in the competition. The results show that leader achievement orientation is a significant predictor of perceived leader effectiveness, leadership emergence and team performance. The other four competencies do not predictieader effectiveness. There is no relation between competencies and transformational leadership; therefore, transformational leadership does not mediate the relation between competencies and effectiveness. The advantages of this study were that we obtained the data regarding the competencies and effectiveness from three different sources and that we measured competencies before the teamwork began. An average of more than 6 subordinates per leader ensures highly reliable evaluations of leaders' transformational leadership, perceived effectiveness and leadership emergence. The results can be applied to leader selection for short-term team projects.","",,"",,,"",""
rayyan-304195368,Culture of Inquiry in Professional Development,2017.0,1,1,,,,,,"Morris, W.V.",,,,,"Research on teacher collaboration and student achievement, along with culture of inquiry theory, was reviewed in an attempt to propose a theory of culture of inquiry for teacher professional development. Three empirical studies on teacher collaboration revealed positive correlations between teacher collaboration and student achievement. The literature on culture of inquiry and relevant theory from organizational management yielded five characteristics essential to a culture in which teachers plan and carry out professional development to evaluate and experiment with new teaching methods: transformational leadership, inquiry and healthy debate, license to experiment, collegiality and sharing, and an ongoing cycle of reflection. © 2017 SAGE Publications.","",,"",,,"",""
rayyan-304195370,Leadership style of school principals and student performance: An exploratory study,2016.0,1,1,,,,,,"Pedraja-Rejas, L. and Rodríguez-Ponce, E. and Rodríguez-Mardones, P.",,,,,"This study aims to explore whether there is a relationship between the leadership style of school principals and the performance of their students. For this purpose, a multiple case study was developed in three private subsidized schools in a city on Northern Chile. The multiple case study included the application of a questionnaire, semi-structured interviews to members of the principal's work team who participated in the study in the three schools, and the consideration of the score obtained by the establishment in a test used for measuring learning outcomes (SIMCE test). Results suggest that in the case of the three schools, transformational leadership has a positive impact on student outcomes. Additionally, unlike what is stated in other studies, transactional leadership is also a key determinant for the achievement obtained by students. Thus, this exploratory research validates the dimensions of the styles of transformational and transactional leadership, contributing to new findings that allow continuing with quantitative larger studies.","",,"",,,"",""
rayyan-304195372,A Causal Relationship Model of Primary Public School Students' Achievement: A Multiple Group Analysis,2021.0,1,1,,,,,,"Prasertcharoensuk, T. and Chaiwan, J. and Tang, K.N. and Makmee, P.",,,,,"This research aimed to examine the causal relationship model of primary school students' achievement. The coverage included all types of primary public schools, namely formal and extended primary, in urban and rural areas, respectively, throughout Thailand. A survey was carried out with 1,200 school administrators and teachers from 600 schools with the intention of testing the goodness of fit of the causal relationship model with the empirical data. Results disclosed that the causal relationship model of students' achievement were identified as congruous with empirical data, with χ2 =58.381, df = 45, χ2/df = 1.307, CFI = 1.000, TLI = 0.999, RMSEA = 0.016, and SRMR = 0.007. In addition, the three main variables, namely teachers' collective efficacy, transformational leadership, and professional learning community, significantly affected students' achievement, directly and positively. On top of that, transformational leadership significantly affected both the variables of teachers' collective efficacy and professional learning community; the professional learning community significantly affected teachers' collective efficacy directly and positively. Finally, the test of invariability of the linear causal relationship model of students' achievement indicated that the two models, in either formal primary school or extended primary, were found to have the goodness of fit with the empirical data. Results contribute significantly to knowledge by proposing the causal relationship model to provide a connection between the three key factors, namely transformational leadership, professional learning community, and teachers' collective efficacy, to improve primary school students' achievement. © Universiti Putra Malaysia Press","",,"",,,"",""
rayyan-304195373,Chinese students' perception and conditions of leadership,2011.0,1,1,,,,,,"Zhao, Y. and Tan, A.-G. and Urhahne, D.",,,,,"One hundred fifty-one Chinese participants rated scales on perceived transformational and change leadership, and perceived conditions of leadership (e.g., leadership experience, interpersonal competence, adaptor-innovator style, achievement goal orientation, and personality). The participants perceived highly their transformational leadership styles. Interpersonal competence was the strongest predictor of transformational and change leadership. Gender was found to be a significant predictor of transformational leadership (both for articulating the vision and fostering the acceptance of group goals). Kirton's originality subscale could predict transformational leadership (articulating the vision). Conscientiousness proved to be a significant predictor of transformational and change leadership. Females rated higher on leadership scales than males, which seems to predispose them to exert transformational and change leadership style in organizations. © 2011 Published by Elsevier Ltd.","",,"",,,"",""
rayyan-304195378,The Nature and Effects of Transformational School Leadership: A Meta-Analytic Review of Unpublished Research,2012.0,1,1,,,,,,"Leithwood, K. and Sun, J.",,,,,"Background: Using meta-analytic review techniques, this study synthesized the results of 79 unpublished studies about the nature of transformational school leadership (TSL) and its impact on the school organization, teachers, and students. This corpus of research associates TSL with 11 specific leadership practices. These practices, as a whole, have moderate positive effects on a wide range of consequential school conditions. They also have moderately strong and positive effects on individual teachers' internal states, followed by their influence on teacher behaviors and collective teachers' internal states. TSL has small but significant positive effects on student achievement. Research Design: This synthesis of unpublished research results is accomplished by a systematic series of meta-correlations and is compared with the results of earlier systematic reviews of published TSL research. Findings: Among the conclusions arising from the study is that several of the most widely advocated models of effective educational leadership actually include many of the same practices. Conclusions: More attention by researchers, practitioners, and researchers needs to be devoted to the impact of specific leadership practices and less to leadership models. © The University Council for Educational Administration 2012.","",,"",,,"",""
rayyan-304195380,A causal model of transformational school leadership and transformational classroom leadership on students' learning achievement,2021.0,1,1,,,,,,"James, D. and Kitcharoen, P.",,,,,"As studies capable of establishing a mediating role of transformational classroom leadership between transformational school leadership and students' learning achievement are short in supply in the Thai high school context, this quantitative study aimed to investigate this role and compared the students' learning achievement among different school sizes. A total of 199 teachers, who taught O-NET and PISA key subjects-45 teachers in English, 77 teachers in science, 77 teachers in math-from the five regions of Thailand representing small, medium, and large school size were recruited through a stratified sampling technique and were asked to rate their principal's transformational school leadership and own transformational classroom leadership. A Thai version of the transformational leadership questionnaire was developed, which consisted of a self-rating and a rater form. Partial Least Square Structural Equation Modeling (PLS-SEM) was employed to find the causal relationship, and ANOVA version SPSS 21 was used to compare the SLA among three different school sizes. The study found that transformational school leadership had direct effects on transformational classroom leadership, but transformational classroom leadership did not have a direct effect on English, science, and math teaching. The study also found that large schools had better students' learning achievement compared to small and medium-sized schools, and small-sized schools had the lowest average score in English, science, and math. Based on these new findings, the study made guidelines for the Thai Ministry of Education, Thai school principals, and Thai teachers. © Common Ground Research Networks, Danty James, Patreeya Kitcharoen, All Rights Reserved.","",,"",,,"",""
rayyan-304195381,"Instructional, Transformational, and Managerial Leadership and Student Achievement: High School Principals Make a Difference",2011.0,1,1,,,,,,"Valentine, J.W. and Prater, M.",,,,,"This statewide study examined the relationships between principal managerial, instructional, and transformational leadership and student achievement in public high schools. Differences in student achievement were found when schools were grouped according to principal leadership factors. Principal leadership behaviors promoting instructional and curriculum improvement were linked to achievement. Within transformational leadership, the principal's ability to identify a vision and provide an appropriate model had the greatest relationship to achievement. Principal educational level also positively correlated with each leadership factor. © 2011 SAGE Publications.","",,"",,,"",""
rayyan-304195385,Humanistic Leadership in Africa: A Relational Ideal of Maat,2024.0,1,1,,,,,,"Zoogah, B.D.",,,,,"The increasing view that “traditional, hierarchical views of leadership are less and less useful given the complexities of our modern world” (Lichtenstein et al., Emergence: Complexity and Organization 8:2–12, 2006) and the heightened level of complexity in Africa necessitate an understanding of leadership that is humanistic, the process by which an individual in a leadership role influences others to achieve desire goals through human-centred principles of trust, ethicality, compassion, and engagement. Humanistic leadership has been part of Africa since the pre-modern era (i.e., ancient Egypt) through the Maat philosophy. Maat is a philosophy of the people of ancient Kemet or black Egypt. It “is a fundamental, pervasive, and enduring element in ancient Egyptian civilization and an inclusive and defining cultural category” (Karenga, Maât. The moral ideal in ancient Egypt: A study in classical African ethics, Routledge, 2004). Such leadership is particularly significant in this era of the Africa Union Agenda 2063, which views one of the critical success factors for the achievement of the agenda as “leadership and political commitment with transformational and visionary qualities at all levels and in all fields.” This view is also encapsulated in the World Economic Forum which indicates that “Africa doesn’t need charity, it needs good leadership.” In addition, the Mo Ibrahim Foundation, advocates effective leadership in Africa, established an award for good national leaders and a proprietary index that gauges the quality of governance and leadership in African countries (Mo Ibrahim Foundation, Governance progress in Africa stalling, reports Mo Ibrahim, 2015). This award has not been won in eight of the twelve years because no leader has been found worthy of the award. The chapter integrates historical, anthropological, and philosophical accounts of leadership in Africa to situate humanistic leadership in modern Africa. The framework is limited to the period before the colonial eras of Africa (i.e., the Kemetic era). Following a brief review of extant leadership in Africa, I discuss the Maatian view of humanistic leadership. Leveraging that historical perspective, I discuss exemplars of humanistic leaders in modern Africa. Three such leaders are Nelson Mandela (Glad and Blanton, Presidential Studies Quarterly 27:565–590, 1997; Pietersen, Leader to Leader 2015:60–66, 2015), Desmond Tutu (Blankstein et al., Excellence through equity: Five principles of courageous leadership to guide achievement for every student. ASCD, 2016), James Mwangi of Equity Bank of Kenya (Chironga et al., Leadership lessons from Africa’s trailblazers. McKinsey Quarterly, 1–10, 2019). While Nelson Mandela and Desmond Tutu epitomize the Ubuntu principles of humanism, James Nwangi exemplifies the Maatian humanistic principles. Both the traditional or ancient view of humanistic leadership which is illustrated with modern leaders affords an opportunity for scholars conducting research on humanistic leadership in Africa to ground their studies in Indigenous philosophical and humanistic principles. Humanistic leadership is proposed as a function of decisions and actions of African traditional orientations that derive from Maat philosophy. This perspective unearths the source of modern understanding of humanistic leadership and reorients the field of leadership development and prevention of bad leadership as they relate to management of organizations in Africa. © The Author(s), under exclusive license to Springer Nature Switzerland AG 2024.","",,"",,,"",""
rayyan-304195386,Pesantren-based Transformational Leadership: Strategies toward International Superior Madrasah in Indonesia,2021.0,1,1,,,,,,"Thoyib, M. and Fauzan, A.",,,,,"Transformational leadership is one of the models for the initial change that can encourage Madrasah Aliyah to excel, both at the national and international levels. This study is a qualitative study with an interactive analysis model on transformational leadership strategies at the international Madrasah Aliyah Amanatul Ummah Mojokerto and the Serpong Insan Cendekia State Madrasah Aliyah. This study concluded that the first strategy to increase the influence of the idealism of the madrasah principal towards an international pesantren-based Madrasah Aliyah is the strong commitment between the principal and teachers, employees, students, as well as parents, beginning with planning (RKM) using school review, quality assurance, benchmarking, and quality control accompanied by exemplary values, an effort to maintain mutual trust as well as the sincerity of all stakeholders. Then, the second strategy is to foster inspirational motivation for the principals of international pesantren-based Madrasah Aliyah which is reflected in the ability of madrasah principals who can motivate and inspire their subordinates to improve the quality of education together. For example, the achievement of madrasah principals, teachers and students winning the international olympiad between 2010-2020 is supported by the principle of Islamic boarding school that is ‘The Islamic Role Model is The First Key to Build Great Leaders’. Furthermore, The third strategy is to strengthen the intellectual stimulus of Madrasah Aliyah’s principal with superior international standards based on Islamic boarding school values, which is reflected in several positive changes made and achieved by the madrasah’s principal, both the quality of the input, process, and output, such as student achievements in national and international levels such as scholarships to the Middle East, Europe, Japan, and Australia. Finally, the last strategy is to transform the madrasah principal’s individualized considereation towards superior international pesantren-based Madrasah Aliyah which is reflected in the ability of madrasah principals in managing human resources appropriately, including managing the right competencies for human resources through the competency development programs for teachers and employees continuously; and improving abilities through training supported by the principles of responsibility and exemplary, which are the characteristics of pesantren. © 2021","",,"",,,"",""
rayyan-304195387,'Doing' social justice in early childhood: The potential of leadership,2013.0,1,1,,,,,,"Hard, L. and Press, F. and Gibson, M.",,,,,"Early childhood education has long been connected with objectives related to social justice. Australian early childhood education and care (ECEC) has its roots in philanthropic and educational reform movements prevalent at the turn of the twentieth century. More recently, with the introduction of the National Early Childhood Reform Agenda, early childhood education has once more been linked to the achievement of aims associated with redressing inequality and disadvantage. The authors argue that educational leaders have an obligation to promote equity as they articulate the needs of marginalised students who are traditionally disadvantaged while they also work towards challenging the social order that affords this circumstance of inequity to exist. Drawing on extant literature, including data from two previously reported Australian studies in which leadership emerged as having a transformational impact on service delivery, this article examines the potential of early childhood leadership to generate 'socially just' educational communities. With reference to critical theory, the authors argue that critically informed, intentional and strategic organisational leadership can play a pivotal role in creating changed circumstances and opportunities for children and families. Such leadership includes positional and distributed elements, articulation of values and beliefs, and collective action that is mindful and informed.","",,"",,,"",""
