key,title,year,month,day,journal,issn,volume,issue,pages,authors,url,language,publisher,location,abstract,notes,doi,keywords,pubmed_id,pmc_id,PDF files,[]
rayyan-304195497,Determinants of Individual Innovation in Nurses: The Effect of Transformational Leadership and Professional-Demographic Factors,2025.0,1,1,,,,,,"Yıldız, A.",,,,,"Aim: This study aims to determine the level of individual innovativeness among nurses and examine the effects of professional and demographic factors and transformational leadership on individual innovativeness. Method: The research was conducted as a cross-sectional study involving 315 nurses. Data were collected using the Individual Innovativeness Scale, Global Transformational Leadership Scale, and information form on socio-demographic and professional characteristics of nurses. Analyses included t-tests, One-way ANOVA, correlation, and regression. Results: The mean individual innovativeness score was 59.41 (SD=9.41), indicating a moderate level. Classification of innovativeness levels showed that 2.9% were ""innovators,"" 13.7% were ""early adopters,"" 42.5% were ""late majority,"" and 34% were ""laggards."" A positive and moderate relationship was found between individual innovativeness and transformational leadership (r=0.66; p<0.05). Professional and demographic variables explained 47% of the total variance in individual innovativeness (R²=0.47; p<0.01), increasing to 62% when transformational leadership was included (R²=0.62; ΔR²=0.15; p<0.01). Age, years of experience, and education were significant predictors of individual innovativeness (p<0.01). Conclusion: The findings reveal a need to improve nurses’ innovativeness and highlight the critical role of transformational leadership in fostering innovative behavior. Promoting transformational leadership skills and implementing innovative professional development programs are recommended in healthcare settings. © 2025 The Authors.","",,"",,,"",""
rayyan-304195501,Comparing the relationships between school principals' leadership types and teachers' academic optimism,2024.0,1,1,,,,,,"Börü, N and Bellibas, MS",,,,,,"",,"",,,"",""
rayyan-304195503,Leadership Styles of Mid-level Educational Leaders Perceived by Academic Members: An Exploratory Study among Chinese Universities,2023.0,1,1,,,,,,"Cheng, Z and Zhu, C",,,,,,"",,"",,,"",""
rayyan-304195504,The relationship between Chinese preschool principal leadership styles and teacher leadership: Exploring the mediating effect of psychological capital,2022.0,1,1,,,,,,"Zhang, LM and Wu, TT and Liu, LJ and Ren, P and Lin, CP",,,,,,"",,"",,,"",""
rayyan-304195505,A Review of Empirical Research on Transformational School Leadership in China (2010-2019),2022.0,1,1,,,,,,"Li, YZ",,,,,,"",,"",,,"",""
rayyan-304195506,The Relationship Between Principal Leadership and Student Achievement: A Multivariate Meta-Analysis with an Emphasis on Conceptual Models and Methodological Approaches,2025.0,1,1,,,,,,"Shen, JP and Wu, H",,,,,,"",,"",,,"",""
rayyan-304195507,Instructional leadership in school middle leaders,2023.0,1,1,,,,,,"Shaked, H",,,,,,"",,"",,,"",""
rayyan-304195508,Understanding the relationship between transformational leadership and collective teacher efficacy in Chinese primary schools,2020.0,1,1,,,,,,"Liu, P and Li, L and Wang, JP",,,,,,"",,"",,,"",""
rayyan-304195509,"The evolving dynamics between instructional leadership, collective teacher efficacy, and dimensions of teacher commitment: what can Chinese independent high schools tell us?",2024.0,1,1,,,,,,"Thien, M and Lima, SY and Adams, D",,,,,,"",,"",,,"",""
rayyan-304195510,Motivating teachers' commitment to change through transformational school leadership in Chinese urban upper secondary schools,2015.0,1,1,,,,,,"Liu, P",,,,,,"",,"",,,"",""
rayyan-304195511,School heads' transformational leadership and students' modernity: the multiple mediating effects of school climates,2019.0,1,1,,,,,,"Wang, ST",,,,,,"",,"",,,"",""
rayyan-304195512,The effects of community-wide distributed leadership on students' academic achievement,2024.0,1,1,,,,,,"Tsuyuguchi, K and Fujiwara, F and Uzuki, Y",,,,,,"",,"",,,"",""
rayyan-304195513,"A Study on the Correlations Among Elementary and Junior High School Principal Leadership for Learning, Teacher Leadership for Learning, and Student Core Competency: Perspective of Competency-Based Education",2022.0,1,1,,,,,,"Chien, WC",,,,,,"",,"",,,"",""
rayyan-304195514,Leadership practices of school principal through a distributed leadership lens: a case study of a secondary school in urban Pakistan,2020.0,1,1,,,,,,"Nawab, A and Asad, MM",,,,,,"",,"",,,"",""
rayyan-304195516,Mapping the terrain: a literature review on school middle leadership in Mainland China,2022.0,1,1,,,,,,"Tang, JJ",,,,,,"",,"",,,"",""
rayyan-304195519,How does teacher-perceived principal leadership affect teacher self-efficacy between different teaching experiences through collaboration in China? A multilevel structural equation model analysis based on threshold,2022.0,1,1,,,,,,"Xie, ZY and Wu, RX and Liu, HY and Liu, J",,,,,,"",,"",,,"",""
rayyan-304195520,School Leader Perspectives on Leadership Learning Preparation and Continuing Professional Development in the Chinese Province of Fujian: An Exploratory Study,2013.0,1,1,,,,,,"Wilson, M and Xue, XM",,,,,,"",,"",,,"",""
rayyan-304195523,Impact of school leadership on teacher innovativeness: evidence from multilevel analysis of Taiwan TALIS 2018,2024.0,1,1,,,,,,"Hsieh, CC and Tai, SE and Li, HC",,,,,,"",,"",,,"",""
rayyan-304195525,The relationship between teacher leadership and collective teacher efficacy in Chinese upper secondary schools,2021.0,1,1,,,,,,"Liu, P",,,,,,"",,"",,,"",""
rayyan-304195526,Inter-school collaboration leaders' behaviors and underlying leadership styles: The case of China,2024.0,1,1,,,,,,"Fang, Z and Liu, HT and Gao, J and Xu, WQ and Song, SY",,,,,,"",,"",,,"",""
rayyan-304195527,The mediating role of school effectiveness in the relationship between transformational leadership and workplace exclusion,2024.0,1,1,,,,,,"Kandemir, A",,,,,,"",,"",,,"",""
rayyan-304195528,A global perspective on school leadership: Evidence from a latent class analysis on OECD TALIS data,2024.0,1,1,,,,,,"Soncin, M and Bowers, AJ and Agasisti, T",,,,,,"",,"",,,"",""
rayyan-304195530,The Impact of Transformational School Leadership on School Staff and School Culture in Primary Schools-A Systematic Review of International Literature,2023.0,1,1,,,,,,"Heenan, IW and De Paor, D and Lafferty, N and McNamara, PM",,,,,,"",,"",,,"",""
rayyan-304195532,"How Leadership, School Culture, Collective Efficacy, Academic Self-Efficacy, and Socioeconomic Status Affect Student Achievement",2021.0,1,1,,,,,,"Bozkurt, S and Çoban, Ö and Özdemir, M and Özdemir, N",,,,,,"",,"",,,"",""
rayyan-304195534,Challenges of difference and difficulty: how do principals enact different leadership for diverse student population in a changing Chinese school context?,2019.0,1,1,,,,,,"Szeto, E and Cheng, AYN and Sin, KKF",,,,,,"",,"",,,"",""
rayyan-304195535,Impact of instructional leadership on high school student academic achievement in China,2019.0,1,1,,,,,,"Hou, YY and Cui, YR and Zhang, DH",,,,,,"",,"",,,"",""
rayyan-304195537,Dual leadership in Chinese schools challenges executive principalships as best fit for 21st century educational development,2022.0,1,1,,,,,,"Cunningham, C and Zhang, W and Striepe, M and Rhodes, D",,,,,,"",,"",,,"",""
rayyan-304195538,Examining principal leadership effects on teacher professional learning in China: A multilevel analysis,2023.0,1,1,,,,,,"Huang, L and Huang, YT and Zhou, SK",,,,,,"",,"",,,"",""
rayyan-304195540,Investigating the mediating effects of professional learning communities on the relationship between leadership practices and teacher collective efficacy: a perspective of Chinese principals,2023.0,1,1,,,,,,"Zhang, J and Huang, QN and Ye, JY",,,,,,"",,"",,,"",""
rayyan-304195542,Impact of school leadership on teacher professional collaboration: evidence from multilevel analysis of Taiwan TALIS 2018,2024.0,1,1,,,,,,"Hsieh, CC and Chen, YR and Li, HC",,,,,,"",,"",,,"",""
rayyan-304195545,Educational leadership on the Chinese mainland: A case study of two secondary schools in Beijing,2017.0,1,1,,,,,,"Lai, MH and Wang, LJ and Shen, W",,,,,,"",,"",,,"",""
rayyan-304195546,How do the leadership strategies of middle leaders affect teachers' learning in schools? A case study from China,2022.0,1,1,,,,,,"Zhang, XL and Wong, JLN and Wang, XF",,,,,,"",,"",,,"",""
rayyan-304195547,Distributed Leadership Promotes Teacher Self-Efficacy in Multicultural Classrooms Through School Capacity Building: A Multilevel SEM Approach Using US Teaching and Learning International Survey,2023.0,1,1,,,,,,"Choi, S",,,,,,"",,"",,,"",""
rayyan-304195549,Examining integrated leadership systems in high schools: connecting principal and teacher leadership to organizational processes and student outcomes,2017.0,1,1,,,,,,"Sebastian, J and Huang, HG and Allensworth, E",,,,,,"",,"",,,"",""
rayyan-304195550,Understanding the relationship between school leaders' social and emotional competence and their transformational leadership: The importance of self-other agreement,2016.0,1,1,,,,,,"Wang, N and Wilhite, S and Martino, D",,,,,,"",,"",,,"",""
rayyan-304195551,Unpacking the effects of culture on school leadership and teacher learning in China,2021.0,1,1,,,,,,"Shengnan, L and Hallinger, P",,,,,,"",,"",,,"",""
rayyan-304195552,Transformational school leadership and teacher self-efficacy as predictors of perceived collective teacher efficacy,2018.0,1,1,,,,,,"Ninkovic, SR and Floric, OCK",,,,,,"",,"",,,"",""
rayyan-304195553,Influence of professional cultures and principal leadership effects on early-career teacher leadership development in Hong Kong schools,2022.0,1,1,,,,,,"Szeto, E",,,,,,"",,"",,,"",""
rayyan-304195554,The Effect of Instructional Leadership and Distributed Leadership on Teacher Self-efficacy and Job Satisfaction: Mediating Roles of Supportive School Culture and Teacher Collaboration,2021.0,1,1,,,,,,"Liu, Y and Bellibas, MS and Gümüs, S",,,,,,"",,"",,,"",""
rayyan-304195555,The Effects of Reform in Principal Selection on Leadership Behavior of General and Vocational High School Principals in Taiwan,2013.0,1,1,,,,,,"Hsiao, HC and Lee, MC and Tu, YL",,,,,,"",,"",,,"",""
rayyan-304195557,Are school leaders working as instructional leaders? Exploration of school leadership practices in rural Pakistan,2022.0,1,1,,,,,,"Noor, T and Nawab, A",,,,,,"",,"",,,"",""
rayyan-304195560,Exploring positive school leadership practices in Iranian primary schools,2022.0,1,1,,,,,,"Kouhsari, M and Navehebrahim, A and Zeinabadi, H and Abbasian, H",,,,,,"",,"",,,"",""
rayyan-304195561,Is Transformational Leadership Theory Passe? Revisiting the Integrative Effect of Instructional Leadership and Transformational Leadership on Student Outcomes,2020.0,1,1,,,,,,"Kwan, P",,,,,,"",,"",,,"",""
rayyan-304195562,Principal instructional leadership in Taiwan: lessons from two decades of research,2015.0,1,1,,,,,,"Pan, HLW and Nyeu, FY and Chen, JS",,,,,,"",,"",,,"",""
rayyan-304195563,Comparing Chinese and U.S. Educational Leadership Styles: A Review of the Literature,2021.0,1,1,,,,,,"Yang, JH",,,,,,"",,"",,,"",""
rayyan-304195565,Analysis of the relationship between school leadership and collective teacher efficacy: a cultural comparison,2022.0,1,1,,,,,,"Kaya, M and Demir, M",,,,,,"",,"",,,"",""
rayyan-304195566,The Effect of Leadership Styles and Initiative Behaviors of School Principals on Teacher Motivation,2021.0,1,1,,,,,,"Yalçinkaya, S and Dagli, G and Altinay, F and Altinay, Z and Kalkan, Ü",,,,,,"",,"",,,"",""
rayyan-304195568,Leadership Styles and School Effectiveness: Empirical Evidence from Secondary Level,2012.0,1,1,,,,,,"Tatlah, IA and Iqbal, MZ",,,,,,"",,"",,,"",""
rayyan-304195569,Transformational Leadership and Collective Efficacy: The Moderating Roles of Collaborative Culture and Teachers' Self-Efficacy,2008.0,1,1,,,,,,"Demir, K",,,,,,"",,"",,,"",""
rayyan-304195570,Leadership and students' academic success: mediating effects of self-efficacy and self-determination,2018.0,1,1,,,,,,"Gannouni, K and Ramboarison-Lalao, L",,,,,,"",,"",,,"",""
rayyan-304195572,"Examining the relationship between school principals' instructional leadership behaviors, teacher self-efficacy, and collective teacher efficacy",2018.0,1,1,,,,,,"Cansoy, R and Parlar, H",,,,,,"",,"",,,"",""
rayyan-304195573,Assessing leadership among Chinese secondary students in Hong Kong: The use of the Poets Rating Scale for Leadership,2000.0,1,1,,,,,,"Chan, DW",,,,,,"",,"",,,"",""
rayyan-304195576,Assessing and strengthening instructional leadership among primary school principals in Vietnam,2018.0,1,1,,,,,,"Nguyen, HT and Hallinger, P and Chen, CW",,,,,,"",,"",,,"",""
rayyan-304195587,Influence of school leadership on collective teacher efficacy: a cross-cultural meta-analysis,2023.0,1,1,,,,,,"Cogaltay, N and Boz, A",,,,,,"",,"",,,"",""
rayyan-304195591,Strategic leadership and school reform in Taiwan,2008.0,1,1,,,,,,"Chen, PY",,,,,,"",,"",,,"",""
rayyan-304195596,Factors Related to Instructional Leadership Perception and Effect of Instructional Leadership on Organizational Variables: A Meta-Analysis,2016.0,1,1,,,,,,"Sisman, M",,,,,,"",,"",,,"",""
rayyan-304195598,Teacher development in rural China: how ineffective school leadership fails to make a difference,2018.0,1,1,,,,,,"Liu, SN and Hallinger, P",,,,,,"",,"",,,"",""
rayyan-304195603,Cross-Level Influence of Group-Focused Transformational Leadership on Organizational Citizenship Behavior among Chinese Secondary School Teachers,2023.0,1,1,,,,,,"Fang, ZT and Yu, SC",,,,,,"",,"",,,"",""
rayyan-304195630,Understanding Leadership for Learning of School Leaders in Disadvantaged Areas in the Context of Education Reform in Vietnam,2024.0,1,1,,,,,,"Tuan, KM and Ha, TTT and Quang, CD and Yen, DTH and Huyen, NP and Thanh, NC",,,,,,"",,"",,,"",""
rayyan-304195634,Understanding teacher leadership identity: the perspectives of Chinese high school teachers,2021.0,1,1,,,,,,"Liu, P and Xiu, Q and Tang, LF and Zhang, YJ",,,,,,"",,"",,,"",""
rayyan-304195638,Does principal leadership make a difference in teacher professional learning? A comparative study China and Thailand,2019.0,1,1,,,,,,"Hallinger, P and Liu, SN and Piyaman, P",,,,,,"",,"",,,"",""
rayyan-304195646,"Principal leadership practices, professional learning communities, and teacher commitment in Hong Kong kindergartens: A multilevel SEM analysis",2023.0,1,1,,,,,,"To, KH and Yin, HBA and Tam, WWY and Keung, CPC",,,,,,"",,"",,,"",""
rayyan-304195650,The Mediating Role of Classroom Climate and Student Self-Efficacy in the Relationship Between Teacher Leadership Style and Student Academic Motivation: Evidence from China,2023.0,1,1,,,,,,"Wang, QM and Lee, KCS and Hoque, KE",,,,,,"",,"",,,"",""
rayyan-304195656,Principal instructional leadership and its influence on teachers' professional development at Vietnamese primary schools,2025.0,1,1,,,,,,"Nguyen, HT and Vu, NTT and Ha, XV and Dinh, HV and Truong, TD and Reynolds, BL",,,,,,"",,"",,,"",""
rayyan-304195662,The effect of department leadership on teacher professional learning in China: A multilevel moderated mediation model,2024.0,1,1,,,,,,"Liu, SN and Hallinger, P",,,,,,"",,"",,,"",""
rayyan-304195667,Perspectives on principal instructional leadership in Vietnam: a preliminary model,2017.0,1,1,,,,,,"Hallinger, P and Walker, A and Nguyen, DTH and Truong, T and Nguyen, TT",,,,,,"",,"",,,"",""
rayyan-304195671,"School reforms, principal leadership, and teacher resistance: evidence from Korea",2013.0,1,1,,,,,,"Park, JH and Jeong, DW",,,,,,"",,"",,,"",""
rayyan-304195674,The effects of principal's leadership style on support for innovation: evidence from Korean vocational high school change,2012.0,1,1,,,,,,"Park, JH",,,,,,"",,"",,,"",""
rayyan-304195677,The Relationship between Principals' Instructional Leadership and Teacher Retention in the Undeveloped Regions of Central and Western China: The Chain-Mediating Role of Role Stress and Affective Commitment,2023.0,1,1,,,,,,"Zhan, QF and Wang, XH and Song, H",,,,,,"",,"",,,"",""
rayyan-304195691,"Instructional leadership, and teacher's collective efficacy, commitment, and professional learning in primary schools: a mediation model",2023.0,1,1,,,,,,"Hosseingholizadeh, R and Amrahi, A and El-Farr, H",,,,,,"",,"",,,"",""
rayyan-304195693,Supporting the professional learning of teachers in China: Does principal leadership make a difference?,2016.0,1,1,,,,,,"Liu, SG and Hallinger, P and Feng, D",,,,,,"",,"",,,"",""
rayyan-304195698,The Chilean principals challenge: Leading from an instructional approach to a distributed approach,2017.0,1,1,,,,,,"Sepúlveda, F and Aparicio, C",,,,,"School leadership is a challenge that requires professionals able to develop a collaborative work culture and oriented to attain high academic expectations. The research associated with school leadership agrees that an effective principal produces a positive effect on the students' academic achievement. Currently, there are three major leadership approaches, which apply to the educational context. Instructional leadership refers to the development of learning improvement plans, while transformational leadership is associated with improving motivation as well as collaborative work. On the other hand, distributed leadership aims to empower people on the task of assuming leadership roles considering school context. This study uses instructional leadership as a cornerstone to define a basic organizational structure for the further development of more sophisticated leadership approaches. The instructional leadership model developed by Hallinger (2012) is used as a reference to suggest specific actions, based on current research, to develop an effective implementation of this school leadership style.","",,"",,,"",""
rayyan-304195700,An integrated model of principal transformational leadership and teacher leadership that is related to teacher self-efficacy and student academic performance,2022.0,1,1,,,,,,"Li, L and Liu, Y",,,,,"Using an integrated school leadership framework, this research intended to investigate 1.whether and to what extent transformational leadership could leverage teacher leadership; 2 the integrated effects of principal transformational leadership and teacher leadership on teacher self-efficacy and student academic performance. This study used a two-stage stratified sampling approach and collected the complex survey data in one Chinese province. Researchers employed a rigorous three-level Structural Equation Model to investigate multi-dimensional relationships among the aforementioned variables. The results suggest that principal transformational leadership is significantly and positively related to teacher leadership. Meanwhile, principal transformational leadership and teacher leadership are both positively related to teacher self-efficacy, but only teacher leadership is positively related to student learning. This study adds nuanced and international evidence and provides a practical framework to improve schools by involving teacher leaders through principal transformational leadership.","",,"",,,"",""
rayyan-304195701,Transactional and Transformational Leadership in the Management of Educational Institutions in Mexico,2024.0,1,1,,,,,,"Ramirez, LL and Llanos, LF",,,,,"Objective: This scientific research article presents the diagnosis of the leadership styles of the chief directors of Mexican educational institutions in their task as promoters of success in their organizations through the achievement of academic excellence. Bass and Avolio's Full Range Leadership theory was used as the guiding axis of the study, in its three styles: transformational, transactional, and non-leadership leadership. Methodology: From a non-probabilistic sample of 30 directors of Mexican educational institutions, basic, intermediate, and higher levels, and using the data obtained from the Multifactorial Leadership Questionnaire ( MlQ ) their leadership styles were identified. Key findings: The results show the directors have a mixed, transactional, and transformational leadership style; in particular, the idealized behavioral influence style stands out. Conclusions: With adequate guidance, it is proposed to develop the transformational leadership talents of directors of educational institutions and their teams. These results are a starting point for future research.","",,"",,,"",""
rayyan-304195704,Instructional leadership and student achievement: school leaders' perspectives,2024.0,1,1,,,,,,"Rodrigues, HPC and Avila de Lima, J",,,,,"Empirical research suggests that school leaders' instructional leadership can make a difference in improving student achievement. We explored this issue in a mixed-method study that sought to verify whether or not, from participants' perspectives, school principals enact this type of leadership and whether or not they feel that it affects student outcomes. The research included a sample of top-level school leaders in a Portuguese region. We analyzed the data with descriptive statistics and content analysis techniques. Participants reported that most of principals' leadership practices did not focus on student learning, but rather on school administration and management. Many respondents felt that it was not their job to lead in several instruction-related areas. Furthermore, respondents regarded the impact of most of principals' instructional leadership practices on student achievement as weak. The paper discusses possible reasons for these findings, including the contextualized nature of the exercise of principal leadership roles, and suggests future avenues for research on this issue.","",,"",,,"",""
rayyan-304195705,More than a principal: Ubuntu at the heart of successful school leadership in the Western Cape,2023.0,1,1,,,,,,"Kramer, M",,,,,"School leadership matters. After teachers and teaching, school leadership is the most important determinant of learner achievement in school. Despite this, there is still uncertainty regarding what successful school leadership is and what successful school leaders do in non-Western contexts. In this mixed methods study I explored successful high school leadership in South Africa. Specifically, a questionnaire was administered to 38 principals from academically high-achieving schools from a range of socioeconomic contexts throughout the Western Cape, and 14 principals were interviewed. An integrated analysis reveals the paradox of uniqueness and universality of successful school leadership in South Africa, outlining that while there is no single best approach, various similarities exist between successful school leaders and established international literature. I found that successful principals adapt to their context, amalgamate transformational, instructional and distributed leadership styles, set direction, develop people, constantly realign the school with teaching and learning, and, importantly, strive to make a difference in the lives of others. It is about leading with Ubuntu. By highlighting these characteristics and practices, I offer theoretical, practical and personal advice to current and aspiring school leaders, academics and policy makers.","",,"",,,"",""
rayyan-304195707,The effects of integrated transformational leadership on achievement,2016.0,1,1,,,,,,"Boberg, JE and Bourgeois, SJ",,,,,"Purpose-Greater understanding about how variables mediate the relationship between leadership and achievement is essential to the success of reform efforts that hold leaders accountable for student learning. The purpose of this paper is to test a model of integrated transformational leadership including three important school mediators. Design/methodology/approach-In total, 5,392 students provided data on student engagement, and 569 teachers provided survey data on principal leadership and the collective teacher efficacy (CTE) and extra effort of their colleagues. Data were analyzed at the school level (n = 51) using mediation analysis with the PROCESS macro to calculate the direct and indirect effects of all of the variables in the serial multiple mediator model. Findings-The model explained a significant amount of variance in both reading (38 percent) and mathematics (35 percent). CTE and student engagement mediated all of the leadership effects, demonstrating the importance of teacher and student relations in school improvement. The combined effect sizes are significantly greater than the effects of earlier TL models. Originality/value-This study contributes to ""leadership for learning"" research by demonstrating that refining transformational leadership behaviors to include instructional management can enhance a leader's impact on achievement. As one of the few studies to examine student engagement as a mediator along with teacher mediators, the current study highlights the importance of teacher-student relations in school improvement. While collective efficacy mediated all of the effects of leadership on achievement, student emotional engagement also contributed to mathematics achievement. The study's findings advance research into mutual influence processes, indicating that reciprocity may extend throughout the leader-teacher-student loop.","",,"",,,"",""
